{
  "$schema": "https://json-schema.org/draft/2020-12/schema",
  "$id": "https://ostrichpki.dev/schema/est-server.schema.json",
  "title": "OstrichPKI EST Server Configuration",
  "description": "Configuration file for ostrich-est-server (RFC 7030). Every key is optional; an omitted key falls back to the matching CLI flag / environment variable, then to the built-in default. Precedence: CLI/env > config file > default.",
  "type": "object",
  "additionalProperties": false,
  "properties": {
    "$schema": {
      "type": "string",
      "description": "Optional reference to this schema, for editor support."
    },
    "bindAddress": {
      "type": "string",
      "description": "Primary listen address (host:port). In mtlsTokenBootstrap mode this is the plain-HTTP in-cluster listener; otherwise the single listener.",
      "examples": ["0.0.0.0:8443", "[::]:8443"]
    },
    "mtlsBindAddress": {
      "type": "string",
      "description": "Separate HTTPS + optional-mTLS listen address for external enrollment, used only with mtlsTokenBootstrap (Traefik passes raw TLS through to it).",
      "examples": ["0.0.0.0:8444"]
    },
    "databaseUrl": {
      "type": "string",
      "description": "PostgreSQL connection URL. Prefer supplying this via the DATABASE_URL environment variable rather than committing it to a file.",
      "pattern": "^postgres(ql)?://"
    },
    "caGrpcUrl": {
      "type": "string",
      "description": "CA gRPC endpoint used for certificate issuance (RFC 7030 §4.2)."
    },
    "caGrpcClientCert": {
      "type": "string",
      "description": "Path to the client certificate (PEM) for mTLS to the CA gRPC service."
    },
    "caGrpcClientKey": {
      "type": "string",
      "description": "Path to the client private key (PEM) for mTLS to the CA gRPC service."
    },
    "caGrpcCaCert": {
      "type": "string",
      "description": "Path to the CA certificate (PEM) that verifies the CA gRPC server."
    },
    "caInsecure": {
      "type": "boolean",
      "description": "DEVELOPMENT ONLY. Allow a plaintext (non-mTLS) gRPC channel to a non-loopback CA endpoint. Never enable in production (NIST 800-53: SC-8, AC-17).",
      "default": false
    },
    "enrollProfile": {
      "type": "string",
      "description": "Certificate profile used for enrollment / re-enrollment.",
      "default": "tls_client"
    },
    "enrollIdentityPolicy": {
      "type": "string",
      "description": "How a CSR's requested identity is authorized against the authenticated account (H1). 'username': the CSR must name the account username in its CN or a SAN. 'allowlist': every asserted identity must be in the account's est_account_identities allow-list.",
      "enum": ["username", "allowlist"],
      "default": "username"
    },
    "tlsCert": {
      "type": "string",
      "description": "Path to the server TLS certificate (PEM)."
    },
    "tlsKey": {
      "type": "string",
      "description": "Path to the server TLS private key (PEM)."
    },
    "tlsCaCert": {
      "type": "string",
      "description": "Path to the trust anchor (PEM) for mTLS client authentication. Its presence enables mTLS (RFC 7030 §3.3)."
    },
    "allowBasicAuth": {
      "type": "boolean",
      "description": "Accept HTTP Basic authentication as a fallback for bootstrap enrollment (RFC 7030 §3.2.3). Requires tlsCaCert (mTLS).",
      "default": false
    },
    "allowBearerAuth": {
      "type": "boolean",
      "description": "Permit bearer-token authentication when no TLS client CA is configured. Explicit, non-default opt-in to a weaker, non-RFC posture.",
      "default": false
    },
    "mtlsTokenBootstrap": {
      "type": "boolean",
      "description": "Serve token bootstrap and mTLS re-enrollment on one port: request (but do not require) client certificates, authenticate /simplereenroll by the client certificate (RFC 7030 §3.3) and /simpleenroll by a single-use bearer enrollment token. Requires tlsCaCert.",
      "default": false
    },
    "caBackends": {
      "type": "array",
      "description": "Named CA backends for RFC 7030 §3.2.2 label-routed enrollment (e.g. an EC CA and an RSA CA). The label's key-algorithm token selects which backend issues.",
      "items": {
        "type": "object",
        "additionalProperties": false,
        "required": ["name", "grpcUrl"],
        "properties": {
          "name": {
            "type": "string",
            "description": "Backend name, referenced by labelRouting.algoBackends / defaultBackend."
          },
          "grpcUrl": {
            "type": "string",
            "description": "CA gRPC endpoint for this backend."
          },
          "clientCert": {
            "type": "string",
            "description": "Path to the mTLS client certificate (PEM) for this backend's gRPC channel."
          },
          "clientKey": {
            "type": "string",
            "description": "Path to the mTLS client private key (PEM)."
          },
          "caCert": {
            "type": "string",
            "description": "Path to the CA certificate (PEM) verifying this backend's gRPC server."
          },
          "caCertificateId": {
            "type": "string",
            "description": "UUID of this backend's issuing CA certificate (in ca_certificates), served by /{label}/cacerts."
          }
        }
      }
    },
    "labelRouting": {
      "type": "object",
      "description": "Maps RFC 7030 §3.2.2 labels to caBackends. Enables the /.well-known/est/{label}/... paths.",
      "additionalProperties": false,
      "required": ["defaultBackend"],
      "properties": {
        "algoBackends": {
          "type": "object",
          "description": "Key-algorithm token ('2048', 'P384') -> backend name.",
          "additionalProperties": { "type": "string" }
        },
        "defaultBackend": {
          "type": "string",
          "description": "Backend used when a label carries no key-algorithm token."
        }
      }
    },
    "logLevel": {
      "type": "string",
      "description": "Log level / filter (e.g. info, debug, ostrich_est=debug).",
      "default": "info"
    },
    "logJson": {
      "type": "boolean",
      "description": "Emit logs as JSON.",
      "default": false
    }
  }
}
